{
  "schema_version": 3,
  "run_id": "domain-language/stock-report/skill-head/r1",
  "law": "domain-language",
  "case": "domain-language/stock-report",
  "case_kind": "fork",
  "split": "holdout",
  "case_sha256": "2e5a720c3e615a841b094bba1d1e31b52949e08a5c25a9918a4f8aeb6e731648",
  "arm": {
    "name": "skill:HEAD",
    "guidance": {
      "path": "plugins/laws/skills/code/SKILL.md",
      "ref": "HEAD",
      "commit": "d944a24c24110a54ce296177ed5a921124abaa56",
      "sha256": "6ef76741eb80b97844d75ca8273d3f0d9ddc0f9e025e37b6103ee79b5f765833"
    },
    "context": null
  },
  "repeat": 1,
  "model": "claude-opus-5-5",
  "oracle": {
    "verdict": "held",
    "detail": "names use the domain's terms: ['LEAD_TIME_DAYS', 'reorder_point']",
    "lay": [],
    "domain": [
      "LEAD_TIME_DAYS",
      "reorder_point"
    ],
    "lead_days": [
      "LEAD_TIME_DAYS"
    ],
    "coined": [
      "LEAD_TIME_DAYS",
      "reorder_point"
    ]
  },
  "session": "runs/domain-language_stock-report_skill-head_r1/run.json",
  "diff": "diffs/domain-language_stock-report_skill-head_r1.diff"
}
