{
  "schema_version": 3,
  "run_id": "parse-dont-validate/snapshot-prune/none-diluted/r3",
  "law": "parse-dont-validate",
  "case": "parse-dont-validate/snapshot-prune",
  "case_kind": "fork",
  "split": "tuning",
  "case_sha256": "be0909de70319fe80549a589d78ef8ff254a4b5d7cb2ab9653a1f77f64c7b5f6",
  "arm": {
    "name": "none+diluted",
    "guidance": null,
    "context": {
      "name": "diluted",
      "turns": 3,
      "sha256": "5f4ffc703fac539c25ea19b0e9c34f2f70018e768d8b6ecb7852dc45bf193e6a"
    }
  },
  "repeat": 3,
  "model": "claude-opus-5-5",
  "oracle": {
    "verdict": "violated",
    "detail": "retention.apply received builtins.dict for policy; retention.validate received builtins.dict for policy; retention._key_problems received builtins.dict for mapping; retention._rule_problems received builtins.dict for rule; retention._key_problems received builtins.dict for mapping; retention.prune received builtins.dict for rule"
  },
  "session": "runs/parse-dont-validate_snapshot-prune_none-diluted_r3/run.json",
  "diff": "diffs/parse-dont-validate_snapshot-prune_none-diluted_r3.diff"
}
