{
  "schema_version": 3,
  "run_id": "parse-dont-validate/snapshot-prune/none-diluted/r1",
  "law": "parse-dont-validate",
  "case": "parse-dont-validate/snapshot-prune",
  "case_kind": "fork",
  "split": "tuning",
  "case_sha256": "f14d0b543dd9bfd6a63a01fb725a8984c228ed72a678b4220b5a8bb9f97c8883",
  "arm": {
    "name": "none+diluted",
    "guidance": null,
    "context": {
      "name": "diluted",
      "turns": 3,
      "sha256": "5f4ffc703fac539c25ea19b0e9c34f2f70018e768d8b6ecb7852dc45bf193e6a"
    }
  },
  "repeat": 1,
  "model": "claude-opus-5-5",
  "oracle": {
    "verdict": "violated",
    "detail": "retention.apply received builtins.dict for policy; retention.check received builtins.dict for policy; retention.prune received builtins.dict for rule"
  },
  "session": "runs/parse-dont-validate_snapshot-prune_none-diluted_r1/run.json",
  "diff": "diffs/parse-dont-validate_snapshot-prune_none-diluted_r1.diff"
}
