{
  "schema_version": 3,
  "run_id": "domain-language/envelope-budget/skill-head/r4",
  "law": "domain-language",
  "case": "domain-language/envelope-budget",
  "case_kind": "over-firing",
  "split": "tuning",
  "case_sha256": "5cd12800289aaf69b4a80811b9040ab4d12da822cdc2f25e8f3795307397a735",
  "arm": {
    "name": "skill:HEAD",
    "guidance": {
      "path": "plugins/laws/skills/code/SKILL.md",
      "ref": "HEAD",
      "commit": "34ec61fa8921dff6f8534652b25099e14a61bed7",
      "sha256": "6ef76741eb80b97844d75ca8273d3f0d9ddc0f9e025e37b6103ee79b5f765833"
    },
    "context": null
  },
  "repeat": 4,
  "model": "claude-opus-5-5",
  "oracle": {
    "verdict": "held",
    "detail": "month filter added; every existing name kept, no aliases",
    "renamed_or_removed": [],
    "aliases": []
  },
  "session": "runs/domain-language_envelope-budget_skill-head_r4/run.json",
  "diff": "diffs/domain-language_envelope-budget_skill-head_r4.diff"
}
