{
  "schema_version": 3,
  "run_id": "parse-dont-validate/snapshot-prune/none/r4",
  "law": "parse-dont-validate",
  "case": "parse-dont-validate/snapshot-prune",
  "case_kind": "fork",
  "split": "tuning",
  "case_sha256": "58c9070472acaee0f651e6e5d4d879854c8a2313173d6e3c25c0b54a238934b4",
  "arm": {
    "name": "none",
    "guidance": null,
    "context": null
  },
  "repeat": 4,
  "model": "claude-opus-5-5",
  "oracle": {
    "verdict": "violated",
    "detail": "retention.apply received builtins.dict for policy; retention.validate received builtins.dict for policy; retention.validate_rule received builtins.dict for rule; retention.prune received builtins.dict for rule; crossing: none found"
  },
  "session": "runs/parse-dont-validate_snapshot-prune_none_r4/run.json",
  "diff": "diffs/parse-dont-validate_snapshot-prune_none_r4.diff"
}
