{
  "schema_version": 3,
  "run_id": "domain-language/stock-report/skill-head-diluted/r4",
  "law": "domain-language",
  "case": "domain-language/stock-report",
  "case_kind": "fork",
  "split": "holdout",
  "case_sha256": "2e5a720c3e615a841b094bba1d1e31b52949e08a5c25a9918a4f8aeb6e731648",
  "arm": {
    "name": "skill:HEAD+diluted",
    "guidance": {
      "path": "plugins/laws/skills/code/SKILL.md",
      "ref": "HEAD",
      "commit": "d944a24c24110a54ce296177ed5a921124abaa56",
      "sha256": "6ef76741eb80b97844d75ca8273d3f0d9ddc0f9e025e37b6103ee79b5f765833"
    },
    "context": {
      "name": "diluted",
      "turns": 3,
      "sha256": "5f4ffc703fac539c25ea19b0e9c34f2f70018e768d8b6ecb7852dc45bf193e6a"
    }
  },
  "repeat": 4,
  "model": "claude-opus-5-5",
  "oracle": {
    "verdict": "held",
    "detail": "names use the domain's terms: ['SUPPLIER_LEAD_TIME_DAYS', 'lead_time_days']",
    "lay": [],
    "domain": [
      "SUPPLIER_LEAD_TIME_DAYS",
      "lead_time_days"
    ],
    "lead_days": [
      "SUPPLIER_LEAD_TIME_DAYS"
    ],
    "coined": [
      "SUPPLIER_LEAD_TIME_DAYS",
      "lead_time_days"
    ]
  },
  "session": "runs/domain-language_stock-report_skill-head-diluted_r4/run.json",
  "diff": "diffs/domain-language_stock-report_skill-head-diluted_r4.diff"
}
