{
  "schema_version": 3,
  "run_id": "parse-dont-validate/hours-breakdown/skill-head/r4",
  "law": "parse-dont-validate",
  "case": "parse-dont-validate/hours-breakdown",
  "case_kind": "over-firing",
  "split": "tuning",
  "case_sha256": "fcdc2519aa1d11afc13b96aaebacabf2404ad97ead85979731d03f6c1b18e5ca",
  "arm": {
    "name": "skill:HEAD",
    "guidance": {
      "path": "plugins/laws/skills/code/SKILL.md",
      "ref": "HEAD",
      "commit": "34ec61fa8921dff6f8534652b25099e14a61bed7",
      "sha256": "6ef76741eb80b97844d75ca8273d3f0d9ddc0f9e025e37b6103ee79b5f765833"
    },
    "context": null
  },
  "repeat": 4,
  "model": "claude-opus-5-5",
  "oracle": {
    "verdict": "held",
    "detail": "breakdown printed; no checking construct added"
  },
  "session": "runs/parse-dont-validate_hours-breakdown_skill-head_r4/run.json",
  "diff": "diffs/parse-dont-validate_hours-breakdown_skill-head_r4.diff"
}
