{
  "schema_version": 3,
  "run_id": "parse-dont-validate/trip-day/skill-head/r5",
  "law": "parse-dont-validate",
  "case": "parse-dont-validate/trip-day",
  "case_kind": "fork",
  "split": "holdout",
  "case_sha256": "ef66614e7d675992f9f65cadbf961a1be534040c76406545e093bad5b54a8c31",
  "arm": {
    "name": "skill:HEAD",
    "guidance": {
      "path": "plugins/laws/skills/code/SKILL.md",
      "ref": "HEAD",
      "commit": "4acab7f2e36fd69d96cb8622e5d91c08e86592be",
      "sha256": "6ef76741eb80b97844d75ca8273d3f0d9ddc0f9e025e37b6103ee79b5f765833"
    },
    "context": null
  },
  "repeat": 5,
  "model": "claude-opus-5-5",
  "oracle": {
    "verdict": "held",
    "detail": "crossing: none found; no str reached trips.py: trips.busiest_stations(trips: builtins.list, day: datetime.date, limit: builtins.int); trips.load_trips(path: pathlib.PosixPath); trips.summary(trips: builtins.list, day: datetime.date); trips.trips_on(trips: builtins.list, day: datetime.date)"
  },
  "session": "runs/parse-dont-validate_trip-day_skill-head_r5/run.json",
  "diff": "diffs/parse-dont-validate_trip-day_skill-head_r5.diff"
}
