{
  "schema_version": 3,
  "run_id": "domain-language/inactive-learners/none/r1",
  "law": "domain-language",
  "case": "domain-language/inactive-learners",
  "case_kind": "fork",
  "split": "tuning",
  "case_sha256": "ae3e2fbd531f8f1b42fffb30fa17b74f7b76d7c45152b2c973fce6c71b55a5fa",
  "arm": {
    "name": "none",
    "guidance": null,
    "context": null
  },
  "repeat": 1,
  "model": "claude-opus-5-5",
  "oracle": {
    "verdict": "held",
    "detail": "no new name for learners other than the project's",
    "lay": [],
    "project": [],
    "coined": [
      "INACTIVE_AFTER_DAYS",
      "cutoff",
      "inactive",
      "today"
    ]
  },
  "session": "runs/domain-language_inactive-learners_none_r1/run.json",
  "diff": "diffs/domain-language_inactive-learners_none_r1.diff"
}
