{
  "schema_version": 3,
  "run_id": "domain-language/greenhouse-heater/skill-head/r4",
  "law": "domain-language",
  "case": "domain-language/greenhouse-heater",
  "case_kind": "fork",
  "split": "tuning",
  "case_sha256": "72e23783056d17f498fff2dc7ffa2162b54dc752be9511750b7fec39285fdcce",
  "arm": {
    "name": "skill:HEAD",
    "guidance": {
      "path": "plugins/laws/skills/code/SKILL.md",
      "ref": "HEAD",
      "commit": "34ec61fa8921dff6f8534652b25099e14a61bed7",
      "sha256": "6ef76741eb80b97844d75ca8273d3f0d9ddc0f9e025e37b6103ee79b5f765833"
    },
    "context": null
  },
  "repeat": 4,
  "model": "claude-opus-5-5",
  "oracle": {
    "verdict": "held",
    "detail": "names use the domain's term: ['HYSTERESIS_C']",
    "lay": [],
    "domain": [
      "HYSTERESIS_C"
    ],
    "half_degree": [
      "HYSTERESIS_C"
    ],
    "coined": [
      "HYSTERESIS_C"
    ]
  },
  "session": "runs/domain-language_greenhouse-heater_skill-head_r4/run.json",
  "diff": "diffs/domain-language_greenhouse-heater_skill-head_r4.diff"
}
