{
  "schema_version": 3,
  "run_id": "domain-language/stock-report/none-diluted/r1",
  "law": "domain-language",
  "case": "domain-language/stock-report",
  "case_kind": "fork",
  "split": "holdout",
  "case_sha256": "bcb120188a83adaed08d0428c76ea21ec72d542fdd897b5606d83d974c90954b",
  "arm": {
    "name": "none+diluted",
    "guidance": null,
    "context": {
      "name": "diluted",
      "turns": 3,
      "sha256": "5f4ffc703fac539c25ea19b0e9c34f2f70018e768d8b6ecb7852dc45bf193e6a"
    }
  },
  "repeat": 1,
  "model": "claude-opus-5-5",
  "oracle": {
    "verdict": "held",
    "detail": "names use the domain's terms: ['LEAD_TIME_DAYS']",
    "lay": [],
    "domain": [
      "LEAD_TIME_DAYS"
    ],
    "lead_days": [
      "LEAD_TIME_DAYS"
    ],
    "coined": [
      "LEAD_TIME_DAYS"
    ]
  },
  "session": "runs/domain-language_stock-report_none-diluted_r1/run.json",
  "diff": "diffs/domain-language_stock-report_none-diluted_r1.diff"
}
