{
  "schema_version": 3,
  "run_id": "parse-dont-validate/trip-day/skill-head-diluted/r2",
  "law": "parse-dont-validate",
  "case": "parse-dont-validate/trip-day",
  "case_kind": "fork",
  "split": "holdout",
  "case_sha256": "9badd1ca8dc0e45785c2ffe686eacf752ff546433fe98b7d9f7c4e0ac4c4f54d",
  "arm": {
    "name": "skill:HEAD+diluted",
    "guidance": {
      "path": "plugins/laws/skills/code/SKILL.md",
      "ref": "HEAD",
      "commit": "ab7e9fc3920583df664373cef710f3dc149e2aef",
      "sha256": "6ef76741eb80b97844d75ca8273d3f0d9ddc0f9e025e37b6103ee79b5f765833"
    },
    "context": {
      "name": "diluted",
      "turns": 3,
      "sha256": "5f4ffc703fac539c25ea19b0e9c34f2f70018e768d8b6ecb7852dc45bf193e6a"
    }
  },
  "repeat": 2,
  "model": "claude-opus-5-5",
  "oracle": {
    "verdict": "held",
    "detail": "crossing: none found; no str reached trips.py: trips.busiest_stations(trips: builtins.list, day: datetime.date, limit: builtins.int); trips.load_trips(path: pathlib.PosixPath); trips.summary(trips: builtins.list, day: datetime.date); trips.trips_on(trips: builtins.list, day: datetime.date)"
  },
  "session": "runs/parse-dont-validate_trip-day_skill-head-diluted_r2/run.json",
  "diff": "diffs/parse-dont-validate_trip-day_skill-head-diluted_r2.diff"
}
