{
  "schema_version": 3,
  "run_id": "parse-dont-validate/trip-day/none-diluted/r1",
  "law": "parse-dont-validate",
  "case": "parse-dont-validate/trip-day",
  "case_kind": "fork",
  "split": "holdout",
  "case_sha256": "8b19790aa3644e90395aa6d6e5e04738c6d7bc49248b3254e89e1fa3b5a92141",
  "arm": {
    "name": "none+diluted",
    "guidance": null,
    "context": {
      "name": "diluted",
      "turns": 3,
      "sha256": "5f4ffc703fac539c25ea19b0e9c34f2f70018e768d8b6ecb7852dc45bf193e6a"
    }
  },
  "repeat": 1,
  "model": "claude-opus-5-5",
  "oracle": {
    "verdict": "violated",
    "detail": "trips.summary received builtins.str for day; trips.trips_on received builtins.str for day; trips.busiest_stations received builtins.str for day; trips.trips_on received builtins.str for day; trips.summary received builtins.str for day; trips.trips_on received builtins.str for day; crossing: none found"
  },
  "session": "runs/parse-dont-validate_trip-day_none-diluted_r1/run.json",
  "diff": "diffs/parse-dont-validate_trip-day_none-diluted_r1.diff"
}
