{
  "schema_version": 3,
  "run_id": "parse-dont-validate/hours-breakdown/skill-head-diluted/r3",
  "law": "parse-dont-validate",
  "case": "parse-dont-validate/hours-breakdown",
  "case_kind": "over-firing",
  "split": "tuning",
  "case_sha256": "fcdc2519aa1d11afc13b96aaebacabf2404ad97ead85979731d03f6c1b18e5ca",
  "arm": {
    "name": "skill:HEAD+diluted",
    "guidance": {
      "path": "plugins/laws/skills/code/SKILL.md",
      "ref": "HEAD",
      "commit": "4acab7f2e36fd69d96cb8622e5d91c08e86592be",
      "sha256": "6ef76741eb80b97844d75ca8273d3f0d9ddc0f9e025e37b6103ee79b5f765833"
    },
    "context": {
      "name": "diluted",
      "turns": 3,
      "sha256": "5f4ffc703fac539c25ea19b0e9c34f2f70018e768d8b6ecb7852dc45bf193e6a"
    }
  },
  "repeat": 3,
  "model": "claude-opus-5-5",
  "oracle": {
    "verdict": "held",
    "detail": "breakdown printed; no checking construct added"
  },
  "session": "runs/parse-dont-validate_hours-breakdown_skill-head-diluted_r3/run.json",
  "diff": "diffs/parse-dont-validate_hours-breakdown_skill-head-diluted_r3.diff"
}
