{
  "schema_version": 3,
  "run_id": "domain-language/greenhouse-heater/none-diluted/r4",
  "law": "domain-language",
  "case": "domain-language/greenhouse-heater",
  "case_kind": "fork",
  "split": "tuning",
  "case_sha256": "72e23783056d17f498fff2dc7ffa2162b54dc752be9511750b7fec39285fdcce",
  "arm": {
    "name": "none+diluted",
    "guidance": null,
    "context": {
      "name": "diluted",
      "turns": 3,
      "sha256": "5f4ffc703fac539c25ea19b0e9c34f2f70018e768d8b6ecb7852dc45bf193e6a"
    }
  },
  "repeat": 4,
  "model": "claude-opus-5-5",
  "oracle": {
    "verdict": "held",
    "detail": "names use the domain's term: ['HYSTERESIS_C']",
    "lay": [],
    "domain": [
      "HYSTERESIS_C"
    ],
    "half_degree": [
      "HYSTERESIS_C"
    ],
    "coined": [
      "HYSTERESIS_C",
      "currently_on"
    ]
  },
  "session": "runs/domain-language_greenhouse-heater_none-diluted_r4/run.json",
  "diff": "diffs/domain-language_greenhouse-heater_none-diluted_r4.diff"
}
