{
  "schema_version": 3,
  "run_id": "domain-language/stock-report/none/r5",
  "law": "domain-language",
  "case": "domain-language/stock-report",
  "case_kind": "fork",
  "split": "holdout",
  "case_sha256": "e410164cc46c856dce073556cdee7c0f412376609f57de419d90b160f029d237",
  "arm": {
    "name": "none",
    "guidance": null,
    "context": null
  },
  "repeat": 5,
  "model": "claude-opus-5-5",
  "oracle": {
    "verdict": "held",
    "detail": "names use the domain's terms: ['LEAD_TIME_DAYS']",
    "lay": [],
    "domain": [
      "LEAD_TIME_DAYS"
    ],
    "lead_days": [
      "LEAD_TIME_DAYS"
    ],
    "coined": [
      "LEAD_TIME_DAYS"
    ]
  },
  "session": "runs/domain-language_stock-report_none_r5/run.json",
  "diff": "diffs/domain-language_stock-report_none_r5.diff"
}
