{
  "schema_version": 3,
  "run_id": "domain-language/inactive-learners/none/r3",
  "law": "domain-language",
  "case": "domain-language/inactive-learners",
  "case_kind": "fork",
  "split": "tuning",
  "case_sha256": "d7137f20ac447c6ac8e37c17bb90f3729b6e7bb2c7d83eb4c70dbbfbd9df7795",
  "arm": {
    "name": "none",
    "guidance": null,
    "context": null
  },
  "repeat": 3,
  "model": "claude-opus-5-5",
  "oracle": {
    "verdict": "held",
    "detail": "no new name for learners other than the project's",
    "lay": [],
    "project": [],
    "coined": [
      "INACTIVE_AFTER",
      "days",
      "inactive",
      "print_inactive",
      "today"
    ]
  },
  "session": "runs/domain-language_inactive-learners_none_r3/run.json",
  "diff": "diffs/domain-language_inactive-learners_none_r3.diff"
}
